control_id,framework,control_area,control_name,in_scope,status,evidence_available,owner_assigned,policy_exists,procedure_exists,tested_recently
SOC2-CC6.3,SOC 2,Logical Access,MFA required for privileged and remote access,Yes,Partial,Yes,Yes,Yes,No,No
SOC2-CC7.2,SOC 2,Change Management,Centralized logging and monitoring,Yes,Partial,Yes,Yes,Yes,Yes,Yes
SOC2-CC7.3,SOC 2,Incident Response,Incident response plan documented and tested,Yes,No,No,Yes,Yes,No,No
HIPAA-A1,HIPAA,Administrative,Risk assessment process,Yes,Partial,Yes,Yes,Yes,No,No
HIPAA-P1,HIPAA,Physical,Facility access controls,Yes,Yes,Yes,Yes,Yes,No,No
HIPAA-T1,HIPAA,Technical,Access control and unique user identification,Yes,Partial,Yes,Yes,Yes,No,No
HIPAA-T2,HIPAA,Technical,Audit logging and activity review,Yes,No,No,Yes,Yes,No,No
